[
  {
    "id": "TC-001",
    "title": "Register new user with valid credentials",
    "description": "Happy path: creating a user with valid username and password returns 201. Spec gap — no endpoint documented; fields inferred from value table.",
    "endpoint": "N/A N/A",
    "test_type": "functional",
    "scenario_operation": "N/A",
    "scenario_scene": "create",
    "scenario_variant": "valid-registration",
    "equivalence_class": "positive",
    "covers_obligations": [
      "REQ-001-AC1"
    ],
    "binds": {},
    "executability": {
      "grade": "DRAFT",
      "orphans": [
        "USER_ID"
      ],
      "forward_references": [],
      "bind_violations": [],
      "spec_blind": [],
      "closure_rate": "0.8",
      "setup_dependency_completeness": "n/a"
    },
    "priority": "high",
    "preconditions": [
      "No existing user with the generated unique username"
    ],
    "steps": [
      "POST <register-endpoint> with headers {Content-Type: application/json} and body {\"username\":\"user_<RUN_ID>@example.com\",\"password\":\"Str0ng!Pass<RUN_ID>\"}",
      "Capture response.body.id as <USER_ID>",
      "Cleanup: DELETE <user-endpoint>/<USER_ID>"
    ],
    "expected_results": [
      "Status 201",
      "response.body.username == \"user_<RUN_ID>@example.com\"",
      "response.body.id is present"
    ],
    "tags": [
      "smoke",
      "auth",
      "functional"
    ]
  },
  {
    "id": "TC-002",
    "title": "Register with empty username returns 400",
    "description": "Boundary: empty required field username must be rejected with 400 VALIDATION_ERROR. Spec gap — no endpoint documented.",
    "endpoint": "N/A N/A",
    "test_type": "boundary",
    "scenario_operation": "N/A",
    "scenario_scene": "create",
    "scenario_variant": "empty-required:username",
    "equivalence_class": "boundary",
    "covers_obligations": [
      "REQ-001-AC2"
    ],
    "binds": {},
    "executability": {
      "grade": "INTEGRATION",
      "orphans": [],
      "forward_references": [],
      "bind_violations": [],
      "spec_blind": [],
      "closure_rate": "1.0",
      "setup_dependency_completeness": "n/a"
    },
    "priority": "high",
    "preconditions": [
      "None"
    ],
    "steps": [
      "POST <register-endpoint> with headers {Content-Type: application/json} and body {\"username\":\"\",\"password\":\"Str0ng!Pass123\"}"
    ],
    "expected_results": [
      "Status 400",
      "response.body.error.code == \"VALIDATION_ERROR\"",
      "response.body.error.details.username is present"
    ],
    "tags": [
      "regression",
      "auth",
      "boundary"
    ]
  },
  {
    "id": "TC-003",
    "title": "Login with valid credentials returns token",
    "description": "Happy path: valid username+password returns 200 with a bearer token. Spec gap — no endpoint documented.",
    "endpoint": "N/A N/A",
    "test_type": "functional",
    "scenario_operation": "N/A",
    "scenario_scene": "auth",
    "scenario_variant": "valid-login",
    "equivalence_class": "positive",
    "covers_obligations": [
      "REQ-001-AC3"
    ],
    "binds": {},
    "executability": {
      "grade": "INTEGRATION",
      "orphans": [],
      "forward_references": [],
      "bind_violations": [],
      "spec_blind": [],
      "closure_rate": "1.0",
      "setup_dependency_completeness": "n/a"
    },
    "priority": "high",
    "preconditions": [
      "A registered user exists (see registration case)"
    ],
    "steps": [
      "POST <login-endpoint> with headers {Content-Type: application/json} and body {\"username\":\"user_<RUN_ID>@example.com\",\"password\":\"Str0ng!Pass<RUN_ID>\"}",
      "Capture response.body.token as <TOKEN>"
    ],
    "expected_results": [
      "Status 200",
      "response.body.token is present and is a non-empty string"
    ],
    "tags": [
      "smoke",
      "auth",
      "functional"
    ]
  },
  {
    "id": "TC-004",
    "title": "Login with invalid password returns 401",
    "description": "Negative: wrong password must return 401 UNAUTHORIZED. Note: conflict_unresolved between 400 and 401 per authoritative table.",
    "endpoint": "N/A N/A",
    "test_type": "negative",
    "scenario_operation": "N/A",
    "scenario_scene": "auth",
    "scenario_variant": "invalid-password",
    "equivalence_class": "negative",
    "covers_obligations": [
      "REQ-001-AC4"
    ],
    "binds": {},
    "executability": {
      "grade": "INTEGRATION",
      "orphans": [],
      "forward_references": [],
      "bind_violations": [],
      "spec_blind": [],
      "closure_rate": "1.0",
      "setup_dependency_completeness": "n/a"
    },
    "priority": "high",
    "preconditions": [
      "A registered user exists"
    ],
    "steps": [
      "POST <login-endpoint> with headers {Content-Type: application/json} and body {\"username\":\"user_<RUN_ID>@example.com\",\"password\":\"WrongPass999\"}"
    ],
    "expected_results": [
      "Status 401",
      "response.body.error.code == \"UNAUTHORIZED\""
    ],
    "tags": [
      "regression",
      "auth",
      "negative"
    ]
  },
  {
    "id": "TC-005",
    "title": "Create book with valid fields",
    "description": "Happy path: creating a book with title, author, price returns 201. Spec gap — no endpoint documented.",
    "endpoint": "N/A N/A",
    "test_type": "functional",
    "scenario_operation": "N/A",
    "scenario_scene": "create",
    "scenario_variant": "valid-book-creation",
    "equivalence_class": "positive",
    "covers_obligations": [
      "REQ-001-AC5"
    ],
    "binds": {},
    "executability": {
      "grade": "DRAFT",
      "orphans": [
        "BOOK_ID"
      ],
      "forward_references": [],
      "bind_violations": [],
      "spec_blind": [],
      "closure_rate": "0.875",
      "setup_dependency_completeness": "n/a"
    },
    "priority": "high",
    "preconditions": [
      "Acquire a Bearer token via login flow and store as <TOKEN>"
    ],
    "steps": [
      "POST <books-endpoint> with headers {Content-Type: application/json, Authorization: Bearer <TOKEN>} and body {\"title\":\"Test Book <RUN_ID>\",\"author\":\"Author <RUN_ID>\",\"price\":29.99}",
      "Capture response.body.id as <BOOK_ID>",
      "Cleanup: DELETE <books-endpoint>/<BOOK_ID> with Authorization: Bearer <TOKEN>"
    ],
    "expected_results": [
      "Status 201",
      "response.body.title == \"Test Book <RUN_ID>\"",
      "response.body.author == \"Author <RUN_ID>\"",
      "response.body.price == 29.99"
    ],
    "tags": [
      "smoke",
      "crud",
      "functional"
    ]
  },
  {
    "id": "TC-006",
    "title": "Create book with negative price returns 400",
    "description": "Boundary: price must be non-negative; negative value triggers VALIDATION_ERROR.",
    "endpoint": "N/A N/A",
    "test_type": "boundary",
    "scenario_operation": "N/A",
    "scenario_scene": "create",
    "scenario_variant": "negative-price",
    "equivalence_class": "boundary",
    "covers_obligations": [
      "REQ-001-AC6"
    ],
    "binds": {},
    "executability": {
      "grade": "INTEGRATION",
      "orphans": [],
      "forward_references": [],
      "bind_violations": [],
      "spec_blind": [],
      "closure_rate": "1.0",
      "setup_dependency_completeness": "n/a"
    },
    "priority": "high",
    "preconditions": [
      "Acquire a Bearer token via login flow and store as <TOKEN>"
    ],
    "steps": [
      "POST <books-endpoint> with headers {Content-Type: application/json, Authorization: Bearer <TOKEN>} and body {\"title\":\"Bad Price Book <RUN_ID>\",\"author\":\"Author <RUN_ID>\",\"price\":-5.00}"
    ],
    "expected_results": [
      "Status 400",
      "response.body.error.code == \"VALIDATION_ERROR\"",
      "response.body.error.details.price is present"
    ],
    "tags": [
      "regression",
      "crud",
      "boundary"
    ]
  },
  {
    "id": "TC-007",
    "title": "Get book by valid ID returns 200",
    "description": "Integration: Create→Read verifies persisted book is retrievable by ID.",
    "endpoint": "N/A N/A",
    "test_type": "integration",
    "scenario_operation": "N/A",
    "scenario_scene": "read",
    "scenario_variant": "create-then-read",
    "equivalence_class": "integration",
    "covers_obligations": [
      "REQ-001-AC7"
    ],
    "binds": {
      "BOOK_ID": {
        "producer": "POST <books-endpoint> response.body.id",
        "consumer": "GET <books-endpoint>/{bookId} path.bookId"
      }
    },
    "executability": {
      "grade": "DRAFT",
      "orphans": [
        "BOOK_ID"
      ],
      "forward_references": [],
      "bind_violations": [
        {
          "class": "malformed_bind",
          "key": "BOOK_ID",
          "detail": "unparseable producer: 'POST <books-endpoint> response.body.id'"
        }
      ],
      "spec_blind": [],
      "closure_rate": "0.9",
      "setup_dependency_completeness": "n/a"
    },
    "priority": "high",
    "preconditions": [
      "Acquire a Bearer token via login flow and store as <TOKEN>",
      "A book has been created (see create book case)"
    ],
    "steps": [
      "POST <books-endpoint> with headers {Content-Type: application/json, Authorization: Bearer <TOKEN>} and body {\"title\":\"Integration Book <RUN_ID>\",\"author\":\"IntAuthor <RUN_ID>\",\"price\":19.99}",
      "Capture response.body.id as <BOOK_ID>",
      "GET <books-endpoint>/<BOOK_ID> with headers {Authorization: Bearer <TOKEN>}",
      "Cleanup: DELETE <books-endpoint>/<BOOK_ID> with Authorization: Bearer <TOKEN>"
    ],
    "expected_results": [
      "Status 200",
      "response.body.title == \"Integration Book <RUN_ID>\"",
      "response.body.id == <BOOK_ID>"
    ],
    "tags": [
      "regression",
      "crud",
      "integration"
    ]
  },
  {
    "id": "TC-008",
    "title": "Get book with non-existent ID returns 404",
    "description": "Negative: requesting a bookId that does not exist returns 404 NOT_FOUND.",
    "endpoint": "N/A N/A",
    "test_type": "negative",